[
  {
    "context": "ccb9432c9c2c8c203230e6b7d31c0b16",
    "origin": "25afdfb85a5c7626b28a77ac4dce92637f7c842a",
    "command": "",
    "start": 1771974863.214706,
    "end": 1771974863.214706,
    "events": {
      "name": "tls::handshake_client",
      "tls::protocol_version": 772
    },
    "spans": [
      {
        "context": "4496299804038c7e426b63ba21e82767",
        "origin": "25afdfb85a5c7626b28a77ac4dce92637f7c842a",
        "command": "",
        "start": 1771974863.2148774,
        "end": 1771974863.2148774,
        "events": {
          "name": "tls::key_exchange",
          "tls::group": 23
        },
        "spans": [
          {
            "context": "f4a8575856bd5e71c9cfeb08004b18a8",
            "origin": "25afdfb85a5c7626b28a77ac4dce92637f7c842a",
            "command": "",
            "start": 1771974863.2148807,
            "end": 1771974863.2148807,
            "events": {
              "name": "pk::generate",
              "pk::algorithm": "EC/ECDSA",
              "pk::curve": "SECP256R1"
            }
          }
        ]
      },
      {
        "context": "5d965925626f231276ab4658c070f0bb",
        "origin": "25afdfb85a5c7626b28a77ac4dce92637f7c842a",
        "command": "",
        "start": 1771974863.2293024,
        "end": 1771974863.2293024,
        "events": {
          "name": "tls::verify",
          "tls::signature_algorithm": 1027
        },
        "spans": [
          {
            "context": "5ffa226b4b1b2e03ac33f016c368daf5",
            "origin": "25afdfb85a5c7626b28a77ac4dce92637f7c842a",
            "command": "",
            "start": 1771974863.22932,
            "end": 1771974863.22932,
            "events": {
              "name": "pk::verify",
              "pk::algorithm": "EC/ECDSA",
              "pk::curve": "SECP256R1",
              "pk::hash": "SHA256"
            }
          }
        ]
      },
      {
        "context": "9c3eb879769d1ca094404184669f6d60",
        "origin": "25afdfb85a5c7626b28a77ac4dce92637f7c842a",
        "command": "",
        "start": 1771974863.2288046,
        "end": 1771974863.2288046,
        "events": {
          "name": "tls::key_exchange",
          "tls::group": 4588
        },
        "spans": [
          {
            "context": "464cbb78dccd784c9b70a5592a97c067",
            "origin": "25afdfb85a5c7626b28a77ac4dce92637f7c842a",
            "command": "",
            "start": 1771974863.229047,
            "end": 1771974863.229047,
            "events": {
              "name": "pk::derive",
              "pk::algorithm": "ECDH (X25519)"
            }
          },
          {
            "context": "6b12b88a73508c86569afb171fc86fa2",
            "origin": "25afdfb85a5c7626b28a77ac4dce92637f7c842a",
            "command": "",
            "start": 1771974863.2288072,
            "end": 1771974863.2288072,
            "events": {
              "name": "pk::decapsulate",
              "pk::algorithm": "ML-KEM-768"
            }
          }
        ]
      },
      {
        "context": "f574d1bf35c80d999cd45243992cbcf3",
        "origin": "25afdfb85a5c7626b28a77ac4dce92637f7c842a",
        "command": "",
        "start": 1771974863.2472508,
        "end": 1771974863.2472508,
        "events": {
          "name": "pk::verify",
          "pk::algorithm": "RSA",
          "pk::bits": 2048
        }
      }
    ]
  },
  {
    "context": "ba622d5b9877a430162242de965c3a3e",
    "origin": "25afdfb85a5c7626b28a77ac4dce92637f7c842a",
    "command": "",
    "start": 1771974923.4500113,
    "end": 1771974923.4500113,
    "events": {
      "name": "tls::handshake_client",
      "tls::protocol_version": 772
    },
    "spans": [
      {
        "context": "086f6407cbc7d1ab26012b7e939373c4",
        "origin": "25afdfb85a5c7626b28a77ac4dce92637f7c842a",
        "command": "",
        "start": 1771974923.4649017,
        "end": 1771974923.4649017,
        "events": {
          "name": "tls::key_exchange",
          "tls::group": 4588
        },
        "spans": [
          {
            "context": "849055c3278578d687c4b54c828ec440",
            "origin": "25afdfb85a5c7626b28a77ac4dce92637f7c842a",
            "command": "",
            "start": 1771974923.4649038,
            "end": 1771974923.4649038,
            "events": {
              "name": "pk::decapsulate",
              "pk::algorithm": "ML-KEM-768"
            }
          },
          {
            "context": "dbdb8d7e3703cb023b12c41af91cad51",
            "origin": "25afdfb85a5c7626b28a77ac4dce92637f7c842a",
            "command": "",
            "start": 1771974923.465125,
            "end": 1771974923.465125,
            "events": {
              "name": "pk::derive",
              "pk::algorithm": "ECDH (X25519)"
            }
          }
        ]
      },
      {
        "context": "174de05063ba9b25008b373abab6edc2",
        "origin": "25afdfb85a5c7626b28a77ac4dce92637f7c842a",
        "command": "",
        "start": 1771974923.4501987,
        "end": 1771974923.4501987,
        "events": {
          "name": "tls::key_exchange",
          "tls::group": 23
        },
        "spans": [
          {
            "context": "ac972e44ea6bcef3b4a63cbe53a80cc9",
            "origin": "25afdfb85a5c7626b28a77ac4dce92637f7c842a",
            "command": "",
            "start": 1771974923.4502006,
            "end": 1771974923.4502006,
            "events": {
              "name": "pk::generate",
              "pk::algorithm": "EC/ECDSA",
              "pk::curve": "SECP256R1"
            }
          }
        ]
      },
      {
        "context": "520f84448e7d46817efd218659951f35",
        "origin": "25afdfb85a5c7626b28a77ac4dce92637f7c842a",
        "command": "",
        "start": 1771974923.4855325,
        "end": 1771974923.4855325,
        "events": {
          "name": "pk::verify",
          "pk::algorithm": "RSA",
          "pk::bits": 2048
        }
      },
      {
        "context": "7efbca0e91133d460bbabf918ea3d2d5",
        "origin": "25afdfb85a5c7626b28a77ac4dce92637f7c842a",
        "command": "",
        "start": 1771974923.4654472,
        "end": 1771974923.4654472,
        "events": {
          "name": "tls::verify",
          "tls::signature_algorithm": 1027
        },
        "spans": [
          {
            "context": "631afe9e5424d5b5b2a69e94388704d7",
            "origin": "25afdfb85a5c7626b28a77ac4dce92637f7c842a",
            "command": "",
            "start": 1771974923.465482,
            "end": 1771974923.465482,
            "events": {
              "name": "pk::verify",
              "pk::algorithm": "EC/ECDSA",
              "pk::curve": "SECP256R1",
              "pk::hash": "SHA256"
            }
          }
        ]
      }
    ]
  }
]